0,Data Scientist,        Novetta,"Crystal City, VA",,223,Machine Learning Engineer,    AdTheorent,"New York, NY",,"The job will involve improving operational efficiency within data science team, building automation pipelines for some existing processes, building Redshift..."224,"Scientist I, Translational Development",        Celgene Corporation,"San Francisco, CA 94158 (South Of Market area)",,"Analyze, interpret and present data. Able to critically analyze and interpret data. Understand the context, impact and timely communication of data...."225,Corporate Engagement Research Analyst,        UC San Diego,"San Diego, CA","$48,000 - $64,000 a year","Substantial experience developing and maintaining database systems using appropriate software applications in order to conduct data analytics, e.g, perform..."226,Research Analyst,        Sweans Technologies,"Wilmington, DE 19809",,Employing a variety of research techniques to understand and analyse online & social data and provide insight about relevant online conversations and voices in...227,Statistician,"    Wiland, Inc.","Niwot, CO 80503",,Experience with data mining tools is a plus. Review and perform quality checks on existing data sources. We use data and sophisticated analytics to predict...228,"Associate Analyst, Operations",        Walmart eCommerce,"San Bruno, CA 94066",,Supports and executes complex and multi-variable recurring and ad-hoc requests for data or data set-up. Ability to analyze data and present findings....229,Research Scientist,        Seattle Children's Hospital,"Seattle, WA 98101 (Downtown area)",,"Makes detailed observations, records data and presents results; There is one opening for a Scientist I-III level...."230,Machine Learning Research Engineer,        BAE Systems,"Arlington, VA",,Enterprise-wide data flow analysis and defense. Seeking Machine learning and Data science expertise for Cutting-edge cyber SECURITY CHALLENGES....231,Remote Sensing Scientist,"        Earth Resources Technology, Inc","Laurel, MD 20707",,Will provide support for data analysis and modeling for multiple aspects of space environmental modeling and prediction....232,Scientist,        Novozymes,"Research Triangle Park, NC",,"Scientist, Bioinformatics and Microbiology, RTP. Knowledge of Big Data within life sciences (preferred). A strong background in bioinformatics and statistical..."233,Statistical Programmer,        Cytel,Oregon,,Producing and supporting systems that extract data from the clinical database; Develops and supports statistical programming computer systems that are used in...234,R&D Business Analyst / Coordinator,        Altair Engineering,"Raymond, OH","$95,000 a year","Maintain/improve/create data management tools (Excel, VBA, Notes databases, SharePoint, QlikView). Gather data and support gap analysis of product development..."235,Analytics Manager (Data Scientist),        Cigna,"Bloomfield, CT",,Experience researching and manipulating complex and large data sets. This role will analyze operational and performance data to uncover opportunities for...236,Associate Analyst,        Walmart eCommerce,"San Bruno, CA 94066",,"Often leverage messy data, and summarize key insightsalways with a focus on the 80/20. We continuously build and invest in new technology including open source..."237,Computational Scientist,    Naval Nuclear Laboratory,"West Mifflin, PA 15122",,"Reactor physics, fluid dynamics, solid mechanics, and/or data science. We are looking for a computational scientist to solve a broad range of engineering..."238,Statistician,        ANALYTICA,"Nashville, TN",,"Data Analysts to provide proactive data analysis results with statistically high probabilities of producing case referrals to law enforcement, overpayments, and..."239,Software Engineer - Machine Learning,    NxT Level,"Seattle, WA","$145,000 - $197,000 a year",Practical experience in using statistics in analyzing and processing data. You’ll join a top-notch technology team that is dedicated to solving some of the...240,Machine Learning Researcher,    QuintilesIMS,"Plymouth Meeting, PA",,"Developing deep learning, machine learning, and data mining technologies. Designing new algorithms to find predictive patterns that combine heterogeneous data..."241,Quantitative Analyst,        Direct Energy,"Houston, TX",,Data management skills in a large enterprise data warehouse environment. 5+ years working within an enterprise data warehouse Big Data environment....242,Senior Analyst,    Quantifind,"Menlo Park, CA",,Quantifind is a uniquely positioned data science and human insights company. You have a solid understanding of fundamental concepts in statistics and data...243,Machine Learning Software Engineer,        L-3 Communications,"Rockwall, TX 75032",,It will require an individual with interest in real-time and near real-time streaming data processing and machine learning applications that enable semi...244,Tableau/Business Intelligence Specialist,        Mondo,"McLean, VA",,You will actively participate in the full range of development activities including working with domain experts and data scientists to characterize important...245,Intern,        Jacobs,"Huntsville, AL",,And presentation skills in order to presenting data to study customers. This position is part of the ESSSA Group to work within a highly integrated team of...246,Research Scientist,        Northwest Evaluation Association,Oregon,,Prepare and validate complex data sets for analyses. Familiarity with SQL and/or Microsoft Access for data extraction....247,Statistician II,        Worldwide Express,"Dallas, TX 75201 (City Center District area)",,"Responsible for assuring that data for statistical analyses are accurate. Generate analysis datasets, tables, figures, and listings to support data analysis..."248,Statistician/Mathematician,        Video Gaming Technologies,"Reno, NV",,The Statistician/Mathematician designs and develops pay tables and new games. This position works independently but with oversight and support from a project249,Statistician,"    IHRC, Inc.","Atlanta, GA 30346",,Experience working within public health data sets and data environments. Develop documentation for releasing data to the general public that includes background...250,Quantitative Analyst,        Houzz,"Palo Alto, CA 94301 (Professorville area)",,This work will include performing complex analysis over large data sets. 2+ years experience with analytics for consumer web and/or mobile applications using...251,Institutional Research Analyst - Morgridge College Of Education,        University of Denver,"Denver, CO",,Strong inclination to be curious about data trends and to take initiative to explore data patterns and share findings via written reports....252,Research Scientist,        Lockheed Martin,"Fort Worth, TX 76108",,"System integration, physics based modeling, data analysis, Radar Cross Section testing, diagnostics testing, and system optimization with a preference in using..."253,Data Scientist (EPIC Social Media Analytics Company),    Thousand Hills Holdings LLC,"Frisco, TX 75033","$100,000 a year",Seeking a Data Scientist to own the scoring platform for celebrities. This Social Media Analytics company has an EPIC perm opportunity with a cutting edge start...254,Principal Research Scientist - Quantitative Psychology/Biostatistics,        Battelle,"Baltimore, MD 21209 (Cheswolde area)",,"Consultation on survey operational issues that impact statistical design and analysis such as randomization plans, data management SOPs, and data capture..."255,Research Analyst II,    Workplace Alaska,"Anchorage, AK","$4,148 a month","Excellent computer skills including the ability to manipulate data, build queries, understand and be comfortable using a variety of data management software..."256,Research Analyst,        University of Baltimore,"Baltimore, MD 21201 (Downtown area)","$41,400 - $55,700 a year",The Research Analyst collects and analyzes data using advanced statistical techniques and independently interprets the data....257,Deep Learning Research Scientist,        SAS Institute,"Cary, NC",,We’re not looking for a data scientist to simply create algorithms but rather a creative and passionate research scientist who wants to touch most every aspect...258,Analytics Consultant,    Tiger Analytics,"Fort Myers, FL",,Subsequently you will work alongside data scientists in your team and to build an analytics solution approach....259,Research Scientist - Cognitive Analytics,        SAS Institute,"Cary, NC",,"Strong theoretical background in data structures and algorithm design. If you synthesize data structures and novel algorithms while mowing the lawn, we may be..."260,Statistical Quantitative Analyst 3,        SunTrust,United States,,"Statistical Quantitative Analyst 3-264713 Description Position: Statistical Quantitative Analyst 3 Location: 303 Peachtree Street NE, Atlanta, GA"261,"Machine Learning Researcher, Analytics Center of Excellence",    QuintilesIMS,United States,,"Developing deep learning, machine learning, and data mining technologies. Designing new algorithms to find predictive patterns that combine heterogeneous data..."262,Research Associate,    PETA/ PETA Foundation,United States,,"Ability to interact effectively with diverse groups of scientists and media representatives. Plan and execute workshops, webinars, and other educational..."263,Accenture Analytics - Data Science Manager,        Accenture,"New York, NY 10011 (Chelsea area)",,"Accenture Analytics – Global Management – Data Scientist. Manage, architect and analyze big data in order to build data driven business insights and high impact..."264,"Statistician, Research and Development",        E.&J. Gallo Winery,"Modesto, CA 95354",,Understand data sets that include spatial and/or temporal auto-correlation with non-normal data. Data Management and Reporting....265,"Manager, Analytics Lab",        TD Ameritrade,"Omaha, NE",,"Understanding of the data warehouse and related data platforms. Exploratory data analysis (EDA), data movement (ETL, ELT) and automation...."266,Program Analyst,    Greystones Group,"Ballston, VA",,"Design and conduct processes and capabilities for the collection of naval STEM initiatives data, and provide analysis of this data to create summary reports and..."267,"Data Scientist, Senior Associate",        Capital One,"Vienna, VA",,"Data Scientist, Senior Associate. Writing software to clean and investigate large, messy data sets of numerical and textual data...."268,"Post-doctoral Social Scientist, Impact Evaluation",        Conservation International,"Arlington, VA 22202 (Aurora Highlands area)",,"Based on organizational priorities, the Social Scientist may subsequently evaluate conservation interventions in other geographies...."269,"Bioinformatics Scientist, Cancer Immunology",        Genentech,"South San Francisco, CA",,"Bioinformatics Scientist, Cancer Immunology. Experience with analyzing next generation sequencing data...."270,Research Analyst,        Commonwealth of Virginia,Virginia,,"Data Extraction and Analysis:. Automates processes for routine data requests. Ability to accomplish data exploration, including interviews and surveys, to..."271,"Scientist, Senior",        Siemens,"Norwood, MA",,"Extensive lab work designing and executing experiments, and analyzing resultant data. Development scientist will serve as a recognized leader and authority in..."272,Statistician,    QuintilesIMS,"Plymouth Meeting, PA",,Experience with large data sets and basic knowledge of SAS programming languages in both PC and mainframe environments is preferred....273,Technology Analyst - Junior,        AECOM,"Arlington, VA 22201 (Lyon Village area)",,Responses to data call. The individual must interface with senior ONR scientists and managers while working cooperatively with the FNC Support Staff to provide...274,Statistician,        General Dynamics Information Technology,"Coralville, IA 52241",,"Plans data collection, and analyzes and interprets statistical data from surveys, experiments, studies, and other sources...."275,OPIR Research Scientist,        Leidos,"Springfield, VA",,"The candidate shall provide support to GEOINT analysis and operation support for data processing, data analysis and analytic support...."276,Scientist,        Exponent,"Menlo Park, CA 94025",,"Exponent's Electrical Engineering & Computer Science Practice is currently hiring for a Scientist in our Menlo Park, CA office...."277,Specialist - Senior Research Scientist,    Hillard Heintze,"Chicago, IL",,"Demonstrating experience with complex relational databases, data warehousing and data management. Designing data collection tools...."278,Engagement Manager,    Simple [A],"Washington, DC",,"We are content engineers, analysts, programmers, developers, architects, content strategists, strategic consultants, data scientists, producers, marketers,..."279,Statistician/Mathematician,        VGT,"Reno, NV",,The Statistician/Mathematician designs and develops pay tables and new games. This position works independently but with oversight and support from a project280,Research Analyst I-Neurology,        Vanderbilt University Medical Center,"Nashville, TN 37232",,"3.With initial supervision, performs basic data analysis and handling. Documentation of data in support of research studies. A research analyst I...."281,Associate Scientist 1 - Reproductive & Genomic Health Assay Dev,"        Illumina, Inc.","San Francisco, CA 94158 (South Of Market area)",,Assesses information to ensure data sufficiency and completeness of results. As an Associate Scientist in the Reproductive and Genomic Health Assay Development...282,Research Assistant I,        Michigan State University,"East Lansing, MI 48824",,"This study involves assistance in participant recruitment, mix-methods (qualitative and quantitative) data collection and analysis, and data display...."283,Lead Software Developer - Data,"    Udacity, Inc.","Mountain View, CA 94040",,Ability to translate the algorithms provided by data scientists and implement them in production. Airflow - Data pipelines and ETL....284,Fair Lending Statistician,        Happy State Bank,"Addison, TX 75001",,Apply statistical techniques to streamline data collection from multiple datasets and data validation procedures;...285,Statistical Programmer,    Institute for Clinical Pharmacodynamics (ICPD),"Buffalo, NY",,"Reviewing data in a graphical, tabular, or other manner in order to verify the integrity, consistency, completeness, accuracy, and suitability of the data...."286,Quantitative Analytics & Model Development Analyst Sr,        PNC Bank,"Tysons Corner, VA",,Data Gathering and Reporting - Working Experience. Analyzes complex data and associated quantitative analysis. Makes recommendations based on findings from data...287,Operation Research Analyst,        General Dynamics Information Technology,"Arlington, VA 22201 (Lyon Village area)",,Conduct data collection through various note taking techniques during the execution of seminars. Then convert this raw data into informative qualitative...288,"Scientist, Computational Biology",        inVentiv Health Clinical,"Daly City, CA",,"These include RNA-expression from single-cells and bulk tissues, variant data from exome sequencing, copy-number data from whole genome sequencing, and..."289,Systems Analyst,"    RadiantBlue Technologies, Inc.","Alexandria, VA",,We build advanced algorithms to gain analytic insights from imagery and geospatial data. Our simulations feed analytic applications so that we can extract...290,Water Resources Engineer/Scientist (FFX),        Tetra Tech,"Fairfax, VA 22030",,"Compile and compute a variety of data; Analyze watershed, hydrodynamic and water quality data using GIS and statistical techniques...."291,Consultant - Operations Research Analyst,        Cardinal Health,"Dublin, OH 43017",,Identifies key data requirements and acquires data; Applies data visualization techniques to evaluate data for model specification etc....292,Data Scientist (People Analytics/HR),    Averity,"New York, NY","$180,000 - $250,000 a year",You should have working experience as a Data Scientist past your education. If you are a Data Scientist with a particular interest in applying data analytics to...293,Research Scientist,"    reNature, Inc. (A Venture Capital Backed Company)","Phoenix, AZ",,"This includes rapid, efficient miniature, semi in-vitro in-house lab-scale bioassays, container assays, greenhouse trials, and microplot trials to support..."294,"Senior Scientist III, Pre-Clinical Safety",    EPM Scientific,"Redwood City, CA","$140,000 a year","Senior Scientist III/ Research Scientist, Pre-Clinical Safety*. Principal Scientist | GLP Toxicology*. Specific role includes maintaining knowledge of emerging..."295,Senior Economist,        HomeAway,"Austin, TX",,"The position requires both building economic models and frameworks, and estimating the core parameters of the model, working in tandem with data scientists and..."296,Machine Learning Engineer - NY,        Morgan Stanley,"New York, NY 10032 (Washington Heights area)",,We are looking for someone to join our team of machine learning engineers and data scientists and help us leverage machine learning to solve financial...297,FORMS AND RECORDS ANALYST 1,        Washington State Patrol,"Bremerton, WA","$2,544 - $3,287 a month",Forensic Scientists who process evidence that assists in prosecuting criminal cases; Are you looking for:....298,Analytical Scientist,        Eurofins,"Spring House, PA",,"Analytical Scientist responsibilities include, but are not limited to, the following :. Eurofins Lancaster Laboratories PSS is searching for an Analytical..."299,Research Associate,        PETA,United States,,"Ability to interact effectively with diverse groups of scientists and media representatives. Plan and execute workshops, webinars, and other educational..."300,"Research Program Analyst, Senior",        Booz Allen Hamilton,"Arlington, VA",,"Job Number: R0002510 Booz Allen Hamilton has been at the forefront of strategy and technology for more than 100 years Today, the firm provides management and"301,"Sr. Data Scientist, Predictive Analytics",        ABBOTT LABORATORIES,"Irving, TX 75038",,"Trains lower-level scientists. Evaluates data using analytical methodologies to achieve results. Main Responsibilities Designs and conducts experiments,..."302,Research Analyst (IGC),        UNC-Chapel Hill,"Chapel Hill, NC",,"This work will involve producing regular reports, custom analysis, and data visualization. This position will spend 50% of its time providing computational..."303,"Computer Vision Research Scientist, PhD University Grad",        Facebook,"Redmond, WA",,Experience with statistical analysis of data and mathematical modeling. Oculus is a world leader in the design of virtual reality systems....304,"Applied Research Scientist, Speech Recognition Acoustic Modeling",        Facebook,"Menlo Park, CA",,Facebook is seeking Speech Recognition Research Scientist to join our Speech Team in Menlo Park. Optimizing acoustic model training procedures especially...305,Scientist,        Universities Space Research Association,"Mountain View, CA",,"The scientist will support evaluating and processing science data in the GeneLab Data System, to make them more accessible to the greater scientific community...."306,BidPal Research Analyst Intern,"    BidPal, Inc.","Indianapolis, IN 46240",,"Strong foundation in data gathering, analysis, and research methods. Skilled in statistical analyses and ability to interpret data and extrapolate results...."307,Sr Principal Statistician,        Medtronic,"Santa Rosa, CA 95403",,This individual will consult on advanced applications for performing the analyses of the resulting data and of documenting the statistical methods and reporting...308,Research Scientist - JUL16-02,        Human Resources Research Organization,"Alexandria, VA",,"Collecting and analyzing data and interpreting results; Human Resources Research Organization (HumRRO) is an industry leader in designing, developing, and..."309,Intern - Quantitative Strategy,        Veterans United Home Loans,"Columbia, MO",,Collaborate with Strategy Analysts and Data Scientists to increase the quality of the data used by the team. Professional development to increase modelling and...310,Jr Quantitative Risk Analyst,        BNY Mellon,"Pittsburgh, PA",,"The incumbent ensures that model development, implementation, data input, reporting, documentation, validation and maintenance use best practices, adhere to..."311,Analyst,"    Metron, Inc.","Reston, VA 20190",,"Our Reston office employs mathematicians, physicists and computer scientists. The successful candidate will interact with customers, both onsite and offsite,..."312,Statistician,        The Johns Hopkins Applied Physics Laboratory,"Laurel, MD",,"The statistician will program, document, and validate software code in R and/or SAS to execute data handling tasks, perform standard data analysis, and produce..."313,Associate/Scientist,        Exponent,"Menlo Park, CA 94025",,"Our multidisciplinary team of scientists, engineers, physicians, and regulatory consultants brings together more than 90 different disciplines to solve..."314,Statistical Geneticist,"        Land O’Lakes, Inc.","Davis, CA",,Proven track record manipulating and analyzing next-generation sequencing data; Strong command of statistics and probability and their application to...315,Senior Scientist I,        AbbVie,"Lake County, IL",,Analyze data and results from multiple experiments; Presents complex technical data to large and diverse groups....316,CLINICAL QUALITY STATISTICIAN,        Children's National Medical Center,"Washington, DC",,"Use of a data warehouse. Process, analyze, and interpret statistical computer-generated data; Will use informatics including specialized statistical software..."317,Machine Learning Data Engineer,        Capital One,"Tysons Corner, VA",,"Machine Learning Data Engineer. At Capital One, we have seas of big data and rivers of fast data. Enterprise Data Services- Machine Learning...."318,Statistician,        Rush University Medical Center,"Chicago, IL",,Examine data to track down potential data inconsistencies. Write and run programs in SAS and S-Plus to carry out statistical analyses of biomedical data...319,Bioinformatics Scientist / Associate Scientist - Translational Oncology,        Genentech,"South San Francisco, CA",,"Bioinformatics Scientist / Associate Scientist - Translational Oncology. You have exceptionally strong communication, data presentation and visualization skills..."320,Predictive Modeling Analyst,        Rescare,"Columbia, SC 29210",,"Our Company's engineering practices, formerly known as Failure Analysis Associates, are the leaders in the investigation, analysis, and prevention of"321,BIOINFORMATICS STAFF SCIENTIST II,        H. Lee Moffitt Cancer Center and Research Institut...,"Tampa, FL",,Experienced bioinformatician that specializes in the analysis of large data sets and is experienced in next-generation sequencing data....322,Contract Statistical Programmer,    Sage Therapeutics,"Cambridge, MA",,"Review SDTM/ADaM TLFs for regulatory, CDISC compliance and SAP Generate/Review specification for SDTM and ADaM mapping Oversight of CROs to ensure quality and..."323,Machine Learning Engineer,        Planet,"San Francisco, CA",,This role is part of a team we are newly forming in 2017 and will help define how we build value on our unique data set....324,"Operations Research Analyst, Mid-Level",        Centra Technology,"McLean, VA",,"The analyst will use sound analytic methods, incorporating effective data visualization methods. CENTRA Technology, Inc...."325,"Senior, Advanced Analytics",        AT&T,"El Segundo, CA 90245",,"If you love data, we’ve got it! No other business has the suite of data we have. We have a dynamic team of seven people focused on customer interactions..."326,Image - Video Analyst,        EOIR Technologies,"Fort Belvoir, VA",,"Data Processing/Analysis Skills. Computer Scientist – Video Analyst. Candidates will support project leads, scientists, and engineers with video analytics and..."327,Statistician,        Precision Castparts Corp.,Nevada,,"Experience with data visualization tools (Tableau preferred). Analyze plant data using data visualization, statistics, and machine learning in order to identify..."328,Associate Statistical Programmer OR Statistical Programmer,        Boehringer Ingelheim,"Ridgefield, CT",,"Data processing, SAS. Databases following the rules of good data base structure and data base. Standard displays that require complex data...."329,Research Associate,    Dillon Allman & Partners,"Bethesda, MD 20814",,He/she will work closely with other Dillon Allman staff in gathering and analyzing data that is relevant to the company's clients along with assisting in...330,Statistician,        Noblis,"Washington, DC",,"Data analysis skills and techniques. Experience with regression analysis and data analysis. Perform regression analysis, trend analysis, decision analysis, data..."331,Research Associate,        Agilent,"Carpinteria, CA",,"Ability to plan studies, analyze data, and interpret results. The Feasibility, Tools and Technologies Group is seeking an Associate Scientist with a strong..."332,Analytics Data Scientist,        MONSANTO,"St. Louis, MO",,"As part of our diverse, highly dynamic group, you will be exposed to exciting quantitative genetics and big data challenges and will work closely with..."