0,Data Scientist,        Novetta,"Crystal City, VA",,551,"Manager, Data Science and Analytics",    The Wonderful Company LLC,"Los Angeles, CA 90064",,Work with data scientists to create algorithms based on your insights. Expert knowledge in turning complex data into actionable insights....552,Bioinformatics postdoc in fungal & bacterial genomics,    Mascoma LLC,"Lebanon, NH 03766",,Improve company-wide access and use of omics data; Experience with data from fungi and/or bacteria (ideally yeast);...553,Research Scientist,"    Grammarly, Inc.","New York, NY",,"Interest in data science. Duties include extracting data from novel sources, developing annotation guidelines, leading annotation efforts, and coordinating..."554,Information Scientist II,        Children's Hospital of Philadelphia,"Philadelphia, PA 19107 (City Center East area)",,Builds the core information infrastructure and develops effective methodologies to support CHOP’s data analysis and data integrity based on a semantic data...555,Principal Data Scientist I,        Concur,"Bellevue, WA",,Grow the community of Data Scientists across Concur and facilitate information sharing and cross-pollination of ideas between analytical organizations....556,"Associate Statistician – Modeling & Simulation – San Francisco, CA",        Evidera,"San Francisco, CA",,"We have an opening in our Biostatistics group to support studies in Health Economics, including analytic support for economic models, meta-analyses/mixed..."557,L&I Research Analyst 1 (3-year project position),        State of Washington,"Tumwater, WA","$2,792 - $3,627 a month","Record data from experiment. Administer surveys and enter data. Knowledge of statistics and techniques for collecting, compiling, and evaluating data...."558,Statistical Programmer,    QuintilesIMS,"Plymouth Meeting, PA",,Experience analyzing very large amounts of data. Experience working with Patient-level and/or medical claims-level data....559,Research Analyst (3 positions),        MiraCosta College,"Oceanside, CA 92056",$33.58 an hour,Identify required data resources; Analyze data for trends and perform statistical analyses; Generate data sets required for grant applications and reporting....560,"Senior Scientist, Protein Engineering",    Intrexon Corporation.,"Germantown, MD",,"Analyze large molecular datasets including transcriptomic, genomics and proteomics data for basic research purposes using in silica molecular modeling software..."561,Credit Risk Transfer Research Analyst,    iiTS,"Washington, DC 20005 (Logan Circle area)","$140,000 a year","Familiarity with Fannie Mae’s historical credit performance and data. Enthusiasm to analyze large data sets and work on hard, ill-defined problems...."562,Information Technology Scientist,        ManTech International Corporation,"Aberdeen Proving Ground, MD",,"Big Data and data fusion platform familiarity. Lead experts in discussion of virtualization, storage and Data analysis...."563,Behavioral Scientist (WRAIR Scientific Services),        Odyssey Systems Consulting Group,"Silver Springs, MD",,"Design surveys, coordinate data collections, collect survey and interview data, process data, archive data by entering all data into appropriate databases, and..."564,Senior Data Scientist and Director of Analytics,"    LL Global, Inc","Windsor, CT",,Serve as the Research/IT Liasion for Data Strategy and Key Data Initiatives. Currently we are looking for a Senior Data Scientist and Director of Analytics for...565,Senior Machine Learning Scientist,    TuSimple LLC,"San Diego, CA",,We’re looking for smart and entrepreneurial people to join the world’s leading scientists and researchers team....566,CLS (MT) / St Mary's of Michigan-Standish / General Lab Anc / PRN Rotating,        St. Mary's,"Standish, MI 48658",,"Performs clerical duties including answering phones, data entry, and filing. Certified Clinical Laboratory Scientist credentialed from the American Society for..."567,Senior Structural Dynamics Analyst,        Technology Service Corporation,"Alexandria, VA",,"Work closely with design engineers, scientists, launch. Vibration and acoustic survey data to structural models to...."568,"Project Associate, EQUAL",    NYU Global TIES for Children,"New York, NY","$52,000 a year",Willingness and ideally interest in developing further statistical and data analysis skills. Alice Wuermli (Research Scientist and Associate Director of Global...569,OPIR Scientist,        Riverside Research,"Springfield, VA",,"Support GEOINT analysis and operation support for data processing, data analysis and analytic support. Responsible for supporting processing, exploitation and..."570,Research Scientist,        Wuxi AppTec,"Plainsboro, NJ",,"Compiles, records, calculates, and analyzes data in accordance with accepted standards and practices. Primary Duties and Responsibilities:...."571,Principal Statistician,        Emergent BioSolutions,"Gaithersburg, MD",,"Those who join Emergent BioSolutions feel a sense of ownership about their future. You will excel in an environment characterized by respect, innovation and"572,Statistical Consultant - Technical Support,        SAS Institute,"Cary, NC",,About SAS: SAS believes in the whole employee experience. Meaningful work. Empowerment to make a difference that changes people’s lives. Dynamic work573,Outcomes Research Statistician (HEOR) (6307291),    BioPoint,"Bridgewater, NJ",,"Conduct observational data analysis, include data management, statistical programming, interpretation of analyses results, and write-up/review the corresponding..."574,Data Scientist Needed for Disruptive Tech Firm,    Averity,"New York, NY","$80,000 - $120,000 a year",We're looking for a Data Scientist to forge our data endeavors forward. As a Data Scientist reporting directly to our Chief Data Officer and Lead Data Scientist...575,Quantitative Analyst/Fixed Income Associate,    Pryor Associates - Pauline Reimer,New York State,,"Quantitative Analyst/Fixed Income Associate opening in New York or Connecticut. Work with asset managers to monitor client portfolios, perform fixed income"576,Research Scientist,        Bennett Aerospace Inc.,"Vicksburg, MS",,Ma i nt a i n records of laboratory data including both laboratory notebooks and electronic media such as spreadshe Perform in data analysis using appropriate...577,Statistician,        UTC Aerospace Systems,"Windsor Locks, CT",,"Exploratory data analysis. Bayesian Data analysis methods. SPC, MSA, process capability, Attribute data analysis...."578,Statistical Business Analyst,    Cresttek LLC,"Raymond, OH",,"Proficient in data analytics funtion, pivot tables, vlookup formulas, and name manager functions Programming:...."579,Statistical Analyst - Acurian (A PPD Company),        PPD,"Horsham, PA",,"Opportunities hidden in the data and making recommendations on pricing,. To ensure the predictive data models efficiently deliver to business...."580,Research Associate,    Nima,"San Francisco, CA",,"Enter, process, evaluate, and present relevant data. Assist engineers and scientists with various product testing, and perform other related job functions...."581,Client Success Manager | Utilities Data Analytics,        Oracle,"San Francisco, CA 94109 (Nob Hill area)",,"Direct the work of data scientists. Meter data in particular. Representatives of the clients to gather requirements on data sources, IT...."582,Business Intelligence Engineer,        Coursera,"Mountain View, CA 94041",,"3-5 years experience in a data-related field, including data engineering, data warehousing, business intelligence, data visualization, and/or data science...."583,Healthcare Statistical Analyst Internship,        Strategic Management,"Alexandria, VA 22315",,"The Statistical Analytics Intern, with guidance from the Senior Consulting Team, will provide analytical and statistical data analysis support utilizing..."584,Director of Business Intelligence,        P.F. Chang's,"Scottsdale, AZ 85255 (North Scottsdale area)",,"Deep experience in statistical analyses, data visualization, data mining, and data cleansing/transformation...."585,"Software Engineer, Data Science Tools",        Cloudera,"San Francisco, CA 94104 (Financial District area)",,The purpose of this team is to accelerate Cloudera’s next stage of growth by enabling data scientists and data engineers to do more with data from exploration...586,Lead Statistical Analysis Engineer,        Schneider National,"Green Bay, WI 54313",,"Identify data sources and prepare data (merging data from different sources, cleansing, manipulation, etc.). Schneider is looking for a Data Scientist to help..."587,Senior Research Scientist I - Assay Development & Screening,        Albany Molecular Research,"Buffalo, NY 14203 (Willert Park area)",,Record all appropriate data electronically in AMRI databases. Trouble shooting of automated equipment and data analysis templates;...588,Watson Health - Research Analyst II - Truven,        IBM,United States,,"Conceptual understanding of data storage in relational and or flat file environments. Perform data investigation on diagnostic, descriptive, and statistical..."589,Dealership Optimization Consultant,        CDK Global,"Houston, TX",,"From data scientists to sales and operations experts, we’re hiring to support your growth and ours - Green light your career ...."590,Healthcare Informatics Analyst,        Wisconsin Physicians Service Insurance Corporation,"Madison, WI 53713",,"Data Analyst, Information Analyst, Technical Analyst, or Data Scientist. You’ll employ statistical and data mining techniques to identify existing issues and..."591,Bioinformatics Scientist,        Digicon,"McLean, VA",,"Demonstrated success supporting next-generation sequencing data analysis. Proven experience deploying tools for genomic data analysis, integration and..."592,Full Time 1 Year Contract Employee - Scientist,        Evonik,"Weston, MI",,"Full Time 1 Year Contract Employee - Scientist. Ability to plan and conduct lab experiment, observe and record experimental data;..."593,Research Scientist III,"        Integrated DNA Technologies, Inc","Coralville, IA 52241",,"Analyzes raw data, reports results and plans the next steps. Data analysis and summary written reports and scientific presentations...."594,"Data Scientist, Analytics",    Affirm,"San Francisco, CA 94126 (Financial District area)",,"Do you love bringing data to life and driving data driven decision making? Build and maintain reporting/visualization, data infrastructure, and tools to help..."595,Statistical Analyst / BI Analyst,        Aetna,"Hartford, CT 06156",,"Aetna takes our candidate’s data privacy seriously. Organize, update and maintain customer retention data using available tools...."596,Senior Data Scientist and Director of Analytics,        LIMRA,"Windsor, CT",,Serve as the Research/IT Liasion for Data Strategy and Key Data Initiatives. Currently we are looking for a Senior Data Scientist and Director of Analytics for...597,ASSOCIATE COMPUTATIONAL SCIENTIST,        Mount Sinai Health System,"New York, NY 10029 (Yorkville area)",,Scientist works with scientists and researchers to effectively use MSSM HPC. Computational and data workflow;...598,Machine Learning Scientist,    Context Relevant,"Seattle, WA 98101 (Downtown area)",,"Big data munger:. At Context Relevant (CR), Machine Learning Scientists develop our core data science platform, building a product that robustly delivers the..."599,Analytical Scientist – PAS,        Eurofins,"Malvern, PA",,"Peer review of analytical data. Scientist responsibilities include, but are not limited to, the following :...."600,Statistician - Level III,    Cavalier IT Solutions,"Raritan, NJ 08869",,"Position: Statistician - Level III Location: RARITAN, NJ / 08869 Job Id: JNJNJP00046523 Duration: 12+ months POSITION TITLE:  *Contract..."601,Research & Development Scientist,        Kao Corporation,"Cincinnati, OH",,"Excellent verbal and written communication skills, with the ability to clearly articulate transfer of thoughts and data...."602,Bioinformatics Scientist,        Counsyl,"South San Francisco, CA 94080",,Strength in modern NGS methods and data analysis toolkits. Work in collaboration with assay development scientists to develop innovative protocols....603,"Principal Statistical Analyst, Bioinformatics",    NIBR,"Cambridge, MA",,"Apply knowledge of regulatory data standards to manage and aggregate pre-clinical and clinical safety data, ensuring data conforms to CDISC, SDTM, AdaM and..."604,Sr. Analyst Research Services,        BDS Marketing,"Washington, DC",,"Are you a data guru? Expertise in Data Visualization tools (PowerBI, Tableau) is a plus. Summarize results in clear and concise deliverables with effective..."605,Medicinal Chemists,    National Center for Advancing Translational Scienc...,"Rockville, MD",,"The NIH Chemical Genomic Center (NCGC) is looking for Research Scientists for our Rockville, Maryland location with expertise in organic synthesis and medicinal..."606,Bioanalytical Scientist,        The Henry M. Jackson Foundation,"Silver Spring, MD 20910",,The contractor shall maintain appropriate data records and QC data for incorporation into LIMs database....607,Research Scientist I - GMP,        Seattle Children's Hospital,"Seattle, WA 98101 (Downtown area)",,"Makes detailed observations, records data, as well as assesses the processes and results for reliability/efficacy/compliance...."608,Research Associate II,        Cedars-Sinai,"Los Angeles, CA",,"Participation in laboratory meetings, keeping laboratory notebooks, performing calculations, tabulating data, summarizing methods and results of related..."609,Market Research Analyst,        St. Louis Post Dispatch,"St. Louis, MO",,The St. Louis Post-Dispatch's Marketing Department is seeking a Research Analyst to become part of the Marketing Research team. The ideal candidate will be610,Research Analyst,"        Deltek, Inc.","Herndon, VA",,"Organize, analyze, and synthesize content or data using Word, Excel, PowerPoint or other internal proprietary collaboration tools as necessary...."611,BioInformatics Scientist,    Cancer Genetics Inc,"Morrisville, NC 27560",,"The Bioinformatics Scientist will also be responsible for likewise analysis of publicly available datasets. To analyze and report, both as patient-level reports..."612,Project Analyst l/ II Gaithersburg Maryland,        Icon plc,"Gaithersburg, MD",,Familiarity with qualitative and/or quantitative data analysis software (preferred). Assist with literature reviews by abstracting data from scientific articles...613,Staff Research Scientist,        Criteo,"Palo Alto, CA 94301 (Professorville area)",,"Stochastic gradient descent is great when you have lots of data. Thankfully, you have billions of data points to help you.· Recommender systems:...."614,"Research Analyst - Supply Chain Technologies, Gartner Research","        Gartner, Inc.","Fort Myers, FL",,"Market research, data collection and analysis. Gartner is the world's leading information technology research and advisory company...."615,Healthcare Informatics Analyst,        WPS Health Solutions,"Madison, WI",,"Data Analyst, Information Analyst, Technical Analyst, or Data Scientist. You’ll employ statistical and data mining techniques to identify existing issues and..."616,Experimentation Analyst,        Walmart eCommerce,"San Bruno, CA 94066",,"Experienced working with massive, messy data sets. Experience working as an analyst / data science consultant. Comfortable using the available data to help make..."617,Statistical Programmer,"    Ironwood Pharmaceuticals, Inc.","Cambridge, MA 02142 (East Cambridge area)",,"Program data edit checks, as necessary, to facilitate Data Management's data cleaning activities. 3+ of experience programming with clinical trial data...."618,Research Analyst,    Nielsen,"New York, NY 10003 (Greenwich Village area)",,"Oversee all data processing and tabulation activities:. Data cleaning, recoding, weighting schema development, tab spec creation, comprehensive table checking,..."619,Research Development Engineer,"    Bailey Information Technology Consultants, LLC","Springfield, VA",,"Research scientist that applies theory to observables or proxy data to address intelligence issues. March 21, 2017...."620,"Research Analyst, Education",        Child Trends,"Bethesda, MD 20814",,"Write code to manage and analyze data; Tabulate data, produce effective graphs, and write up analysis results...."621,Statistical Business Analyst,    Lumenance LLC,"Raymond, OH 43067",,"Identify new sources of data and methods to improve data collection, analysis, and reporting. Normal / Non-Normal data usage experience...."622,"Marketing Decision Scientist, Building 8",        Facebook,"Menlo Park, CA",,"Translate data insights into actions and recommendations. The ideal candidate will have a strong stakeholder management and leadership track record, proven..."623,Creative Research Analyst,        Solugenix Corporation,"Los Angeles, CA",$72.41 an hour,Provides data to designers for the creation charts and graphs. Collaborates with the statistical results group to ensure accuracy in data....624,Advanced Analytics - Analyst,        Merkle Inc.,"Columbia, MD 21046",,Could blend into MI or Data Scientist responsibilities. External Data Enhancement. Data Analysis and Mining....625,"Senior Manager of Data Science, Tech College",        Capital One,"McLean, VA",,"We are looking for a Data Scientist to join our Tech College. Writing software to clean and investigate large, messy data sets of numerical and textual data...."626,Bioinformatics Scientist,"    Integrated Laboratory Systems, Inc","Research Triangle Park, NC",,"Define work flows and data management procedures for collection, integration, storage and analysis of large volumes of complex genomic data sets (current..."627,Research Analyst/Dispatcher,    CarrierLists.com,"Owasso, OK",$15 - $20 an hour,CarrierLists.com publishes trucking company data for shippers and brokers. We are currently looking for individuals to conduct research on trucking and...628,Network Developer,        BOEING,"Fairfax, VA",,Skilled scientists and thinkers. Understanding of data encryption methodologies. As part of this team you will be integral in the development and upgrade of...629,Bioinformatics Scientist,        P&G,"Cincinnati, OH",,Extensive experience working on large biological data sets (e.g. Demonstrated skills in applying/developing/improving machine learning and pattern recognition...630,Research Coverage Analyst,    GuideStar Clinical Reserach,"New Orleans, LA 70170 (Central Business District area)",,GuideStar is seeking a Research Coverage Analyst who will be responsible for the preparation of Medicare Coverage Analysis to ensure that billing for both631,"Analytics Director, Emerging Technologies",        Cigna,"Bloomfield, CT",,"Team leadership to data scientists to ensure they are growing their. Learning and big data analytics. Power-pivots, cubes, data warehouse, and datamarts...."632,Lead R&D Technician,        Honeywell,"Colonial Heights, VA 23834",,Organize own work load to permit multitasking between data collection on one or more instruments while preparing additional samples or analyzing existing data....633,Market Research Analyst,        Weatherford,"Houston, TX 77056 (Galleria-Uptown area)",,JOB DESCRIPTION JOB SCOPE: The Market Research Analyst is responsible for research and analysis of industry and market trends for all business units of634,Research Analyst,    Kansas Department of Labor,"Topeka, KS",,"One year of experience in collecting, evaluating, studying or reporting on statistical, and economic data...."635,Data Quality Analyst,        Domino's,"Ann Arbor, MI",,"Must have - Expertise with data quality tools for data profiling, cleansing and standardization. Works closely with Business Analysts, Data Analysts/Scientists,..."636,Syndicated Health - Research Analyst,        Ipsos North America,"Mahwah, NJ",,"Conduct desk research, create data analysis plans, interpret data, write reports and prepare client presentations...."637,United States Houston:Supply Chain Statistician,        Halliburton,"Houston, TX",,"Job Details United States Houston: Supply Chain Statistician United States Houston: Supply Chain Statistician Date: Apr 1, 2017 Location: Houston, TX, US,"638,Principal Scientist - Computational Chemistry / Chemical Informatics,        Celgene Corporation,Massachusetts,,Principal Scientist in the Computational Chemistry Department. Enhance our understanding of SAR and influence team strategy by assimilating and interpreting...639,Scientist II Analysis & Testing,        International Paper,"Federal Way, WA 98001",,"Ability to analyze, summarize and communicate technical data using MS Office software. Plan, conduct, and document experimental work that meets the data and..."640,Research Analyst: National Parks & Public Lands,    Resource Systems Group Inc.,"White River Junction, VT",,"Managing and fielding data collection efforts; Aptitude for working with data and conducting analyses using statistical packages, databases, and spreadsheets, e..."641,Structuring Quantitative Analyst,        Just Energy,"Houston, TX 77056 (Galleria-Uptown area)",,"Structuring Quantitative Analyst - (1700071) Description Structuring Quantitative Analyst Location: Houston, Texas Your Opportunity: The Structuring"642,Head of Behavioral Analytics,        Atlassian,"San Francisco, CA 94103 (South Of Market area)",,Growing analysts and data scientists. We're looking for someone who is deeply data driven and able to use their influence to improve Atlassian's usage of the...643,Scientist,    Northbound LLC,"Barrington, IL 60010",,Scientist and documentation specialist. Scientist and documentation specialist plays a key role in R&D US team....644,"Imagery Scientist, Journeyman",        Leidos,"Springfield, VA",,"The image scientist will collaborate with and provide scientific analysis support to full spectrum GEOINT (FSG) data to imagery and geospatial analysts, to..."645,Senior Research Scientist,    MachineZone,"Palo Alto, CA",,"Data driven decision-making is integral to game development, platform, marketing and operations at MZ. Experience with mining of data streams and frameworks..."646,Intelligence Analyst SME,    The Tauri Group,"Alexandria, VA",,"Analyze data, develop information, and assess available solutions or alternative. At The Tauri Group, you'll collaborate with an elite, creative team of..."647,Research Scientist: Personalization Sciences,        Yahoo! Inc.,"Sunnyvale, CA",,"In Machine Learning, Data Mining, IR, Statistics, AI or a related field. Demonstrated expertise and desire to work hands-on in analyzing and modeling large data..."648,Exercise Physiology Senior Scientist,        The Henry M. Jackson Foundation,"Bethesda, MD 20817",,"Experience in interpreting research data and peer-reviewed publications. Knowledge of electronic data processing, and statistical and analytical procedures...."649,Principal Statistician,        Covance,"Raleigh-Durham, NC",,SAS programming and related activities for the presentation and analysis of clinical trial data. SAS proficiency including use of a variety of statistical...650,"Research Analyst, Senior",        Booz Allen Hamilton,"McLean, VA",,"Job Number: R0001428 Booz Allen Hamilton has been at the forefront of strategy and technology for more than 100 years Today, the firm provides management and"651,"Contracts Associate, External Research Project Management",        Genentech,"South San Francisco, CA",,"Data entry in the relevant databases. The Project Manager will work closely with Legal and will regularly liaise with Research scientists, senior management, as..."652,Scientist-Software Engineer (ADX003-17),    ArcherDX,"Boulder, CO",,Demonstrated ability to create data visualizations; The commercial “Scientist - Software Engineer” position is responsible for development of software...653,Watson Health - Senior Methods Analyst - Truven,        IBM,United States,,"Work collaboratively with data scientists, clinicians, and other experts to ensure that methodologies meet the stated business requirements...."654,"Team Lead-Product Owner, Service Analytics",        Teradata,"San Diego, CA",,"Experience with big data platform technologies, extensive knowledge of data integration, enterprise data warehouse and data lake...."655,Remote Sensing Scientist,        The Aerospace Corporation,"Chantilly, VA 20151",,Our state-of-the-art laboratory facilities are staffed by some of the leading scientists in the world. At least 8 years of experience with electro-optical...656,Frontend Engineer,605,"New York, NY","$95,000 - $130,000 a year","Our team of data scientists pioneered the field of TV data analytics. At 605 we are engineers, analysts, data scientists, media experts, marketing strategists..."657,"Senior Business Analyst, Underwriting Analytics",        AIG,"New York, NY",,"Collaborate with colleagues in a variety of roles across AIG, from senior business stakeholders to IT professionals and data scientists...."658,Quantitative Analyst,        Bremer Bank,"Saint Paul, MN",,Responsible for constructing and maintaining econometric models with a focus on regression and time series data analysis....659,Research Stakeholder Coordination Analyst DODP12,    E3 Federal,"Alexandria, VA",,"Manage data requests to entities regarding programs, projects, budgets, and progress Support working groups including managing meeting logistics;..."660,Statistician,        Veterans Medical Research Foundation,"San Diego, CA",,"Support management of data by implementing detailed mapping of data elements from different longitudinal studies, including direct mapping and creating of..."