0,Data Scientist,        Novetta,"Crystal City, VA",,1,Data Scientist,"    Syntelli Solutions, Inc","Charlotte, NC 28277",,2,Machine Learning Data Engineer,        Capital One,"Tysons Corner, VA",,3,Statistical Associate,        Disney Parks & Resorts,"Lake Buena Vista, FL",,"Analyze and summarize data form multiple data sources (e.g., Food & Beverage Data Warehouse, D3, SAP, Longview)...."4,"City Research Scientist, Modeling and Water Quality Planning",    DEPT OF ENVIRONMENT PROTECTION,"Queens, NY","$78,630 - $103,332 a year",Data and statistical analysis. Computer programming to analyze data and pre/post process model runs. The research scientist will be responsible for the...5,Statistical Assistant,        Educational Testing Service,"Princeton, NJ 08541",,"Statistics, mathematics, data analysis, statistical analysis, data processing, psychology. Assemble and process data for routine statistical operations...."6,Statistician - Research,    Portland VA Research Foundation,"Portland, OR",,"Extensive experience using SAS or other statistical software to analyze data from large clinical or administrative datasets, such as hospital and patient record..."7,R & D Scientist **AMENDED,        National Geospatial-Intelligence Agency,"Springfield, VA","$94,796 - $145,629 a year",Particular challenges associated with the types of data this group analyzes include correlation across data sets assembled from multiple types of sensors and...8,Graph Analytics/Machine Learning Senior Researcher,        Leidos,"Arlington, VA 22202 (Aurora Highlands area)",,"Strong data analysis skills using R or a comparable platform, and one programming language, e.g. Python, Perl, C/C++, Java...."9,"Data Scientist, Analytics",    Oculus VR,"Menlo Park, CA",,The Data Scientist Analytics role has work across the following four areas:. We’re looking for Data Scientists to work on our core and business products at...10,Statistician,        ACI Federal,"Bethesda, MD",,"Collects, classifies and analyzes quantified and statistical data inprojects and special studies...."11,Corporate Research Operations Analyst,        DiscoverOrg,"Vancouver, WA",,"You have experience in data analysis or project management. Match, merge, and append data from different sources (Excel spreadsheets, text files, etc.)...."12,Statistical Assistant,        Mathematica Policy Research,"Washington, DC 20024 (South West area)",,"Assistants support all statistical activities including survey sampling, data analysis, and project management...."13,Data Scientist,    xometry,"Durham, NC",,14,Data Scientist,        Deloitte,"Arlington, VA 22209",,15,Research Scientist,        Child Trends,"Bethesda, MD 20814",,"Experience with primary data collection and data management. Knowledgeable about data security. It requires the ability to design a research approach, guide..."16,Entry-level Technology Analyst,        AECOM,"Arlington, VA 22201 (Lyon Village area)",,Responses to data call. The individual must interface with senior ONR scientists and managers while working cooperatively with the FNC Support Staff to provide...17,Statistical Regression Analyst,        Technology Service Corporation,"Arlington, VA 22202 (Aurora Highlands area)",,"Government, contractor, and documented data reserves to generate tailored information. Ability to search government and commercial sources of data focused on..."18,Statistician III,        Commonwealth of Massachusetts,"Milford, MA 01757","$55,017 - $78,763 a year","Accepted research methods, data collection and auditing, advanced data analysis. Experience in applying research techniques and advanced data analysis to actual..."19,Statistician - Administration,        George Washington Medical Faculty Associates,"Washington, DC",,"Perform statistical data analyses. Validate the accuracy, consistency and integrity of the statistical output generated during data analysis of study data...."20,Business Development Research Analyst,        Booz Allen Hamilton,"McLean, VA",,"Experience with analyzing data. Booz Allen Hamilton has been at the forefront of strategy and technology for more than 100 years Today, the firm provides..."21,Senior Statistical Researcher - Sheriff Department,        City and County of Denver,"Denver, CO 80216 (Northern Denver area)","$55,132 - $88,211 a year","Law enforcement experience involving statistical and data analysis; Develops error checking programs and assures data collected is reliable, timely and valid..."22,Busness Development Research Analyst,        Booz Allen Hamilton,"McLean, VA",,"Job Number: R0004061 Booz Allen Hamilton has been at the forefront of strategy and technology for more than 100 years Today, the firm provides management and"23,Machine Learning Specialist,        Uber,"Pittsburgh, PA 15201 (Central Lawrenceville area)",,"Uber Advanced Technologies Group (ATG) is the R&D hub of Uber’s engineering team dedicated to self-driving technologies, mapping, and vehicle safety. This"24,Machine Learning Engineer,        IBM,"Denver, CO 80237 (Southeastern Denver area)",,"Foundation in core Computer Science (CS) competencies including data structures, algorithms and object oriented design...."25,Research Scientist,        University of Virginia,"Charlottesville, VA",,The candidate will generate pre-clinical data in xenografts for CARs that have already been developed and will work with Dr....26,Machine Learning Research Scientist - 2004504,    Software Engineering Institute,"Pittsburgh, PA 15213 (North Oakland area)",,"Engineering efficient data intake, processing, and reporting streams for a variety of intelligence-related data...."27,Machine Learning Engineer,        Verizon,"Township of Warren, NJ 07059",,"Bachelor’s degree in a field such as Computer Science, Computer Engineering, Statistics, Economics, Mathematics, Physics Experience in at least one major AI/NLP..."28,"2017 Summer Analyst, Equity Research",    FBR & Co.,"Arlington, VA 22209 (Radnor-Ft Myer Heights area)",,"2017 Summer Associate, Equity Research Overview of FBR FBR & Co. (Nasdaq: FBRC) provides investment banking, merger and acquisition advisory, institutional"29,Research Scientist (Machine Learning),        NVIDIA,"Westford, MA 01886",,We are now looking for a Research Scientist (Machine Learning). NVIDIA is searching for a world-class researcher in machine learning to join our research team....30,Senior Projections and Statistical Analy...,        Employment Security Department,"Lacey, WA","$70,000 - $85,000 a year","Administering data sets of any stage of a study, including raw, cleaned, analyzed and results data sets...."31,Research Engineering/ Scientist Associate III (Exempt),        University of Texas at Austin,"Austin, TX","$4,166 a month",Experience/interest in data analysis and programming. Identify potential use of data for model improvement. Manage real-world applications of the research team...32,"Research Analyst, Global Policy",        Sanofi,"Washington, DC",,"This may require the identification and use of existing internal and external data, as well as constructing or manipulating data as needed, to support requests..."33,Staff Scientist,        Siemens,"Hoffman Estates, IL 60169",,Demonstrated strong analytical and data analysis skills. Ability to communicate with both scientists and non-scientists is essential....34,Analytics Engineer (Boston),    QuantumBlack,"Boston, MA",,"Work closely with Data Engineers and Data Scientists to create analytical variables, metrics, and models. You’re exceptionally talented, and looking to work in..."35,Research Statistician,    Orange County Fire Resue Department,"Winter Park, FL","$58,656 - $75,608 a year","Provides data to substantiate public policy position of concern to external governmental bodies and the media. Provides planning, research, and needs assessment..."36,Research Development Engineer/Scientist,    TULK llc,"Alexandria, VA","$160,000 a year",We are seeking a research scientist that applies theory to observables or proxy data to address intelligence issues in the geospatial domain....37,Statistician,        Karna LLC,"Rockville, MD",,"Create costume data files for approved proposals using restricted data from the RDC data portfolio. Statistician, SAS, statistical analysis, SUDAAN, STATA, data..."38,"Program Analyst (Military Medical Research, Development, and Acquisition)",    Knowesis Inc.,"Falls Church, VA 22040",,"Possession of facilitation, critical thinking, analytical, quantitative, and data gathering skills. Has been providing data driven decisions and solutions to..."39,Machine Learning Scientist,        EBSCO Information Services,"Ipswich, MA",,Machine Learning Scientist. Able to structure and process qualitative or quantitative data and draw insightful conclusions from it....40,Data Analytics Engineer,    Fractal Industries,"Reston, VA",,Refactor algorithms created by our Data Scientists into production-quality and operational code. Data Analytics – Cyber Team Lead....41,Statistician,        Aequor Technologies,"Berkeley Heights, NJ",,Experience with time-to-event data. Support regulatory responses using Medical affairs interventional and registry data....42,Statistician,"    CES, LLC","Nashville, TN","$60,000 - $73,000 a year",SAS/ data analysis applications:. Data Analysts to provide proactive data analysis results with statistically high probabilities of producing case referrals to...43,"senior decision scientist, Business Strategy - Seattle, WA",        Starbucks,"Seattle, WA 98134 (Industrial District area)",,"Expert Ability to collect data using a variety of methods, such as data mining and hard copy or electronic documentation study to improve or expand databases...."44,"Analyst - Healthcare Analytics & Delivery, McKinsey New Ventures",        McKinsey & Company,"Washington, DC 20036 (Downtown area)",,"It is a unique mix of Healthcare Experts, physicians, statisticians, engineers, data scientists, and more. You will work with our Technology team to turn the..."45,Machine Learning Scientist,        DST Systems,"Kansas City, MO",,"They work closely with cross-functional business units, software engineering, and data scientists to simulate and test econometric/probabilistic relationships..."46,Machine Learning Software Researcher,        ARM,"San Jose, CA",,"About the Role We are looking to add exceptional researchers to our Machine Learning research team at ARM in San Jose, CA. As the industry's leading supplier..."47,"Analyst, Research",        National Rural Electric Cooperative Association (N...,"Larchwood, IA",,"Preparing and analyzing data and figures; Manages standardized, recurring projects such as ACSI and Contact Follow-up studies with responsibility for data..."48,Machine Learning Software Researcher,    ARM Ltd.,"San Jose, CA",,"About the Role We are looking to add exceptional researchers to our Machine Learning research team at ARM in San Jose, CA. As the industry's leading supplier..."49,Research Analyst,        BRTRC,"Vienna, VA",,"BRTRC, a growing government contractor, is seeking a Research Analyst. This position is ideal for recent college graduates, looking for an entry-level, foot"50,Computational Social Scientist,        Booz Allen Hamilton,"McLean, VA",,"Computational Social Scientist. 3 years of experience with reviewing academic research papers and computer code to validate the methods assumptions, fit it to a..."51,Sr R/D Engineer,        Medtronic,"Santa Ana, CA",,Performs data analysis (statistical and practical) and develops appropriate action plans based upon such analysis....52,Research Program Analyst,        Booz Allen Hamilton,"Arlington, VA",,"Job Number: R0003661 Booz Allen Hamilton has been at the forefront of strategy and technology for more than 100 years Today, the firm provides management and"53,Statistician,        Medtronic,"Minneapolis, MN",,"Improve data quality, data accessibility, and analytical processes. Maintain proficiency in statistical techniques, programming, and data management best..."54,Machine Learning Engineer,        Dropbox,"San Francisco, CA",,"With our broad mission and massive scale, there are countless opportunities to make an impact.Dropbox’s Machine Learning group develops high impact solutions..."55,Research Engineering/ Scientist Assistant,        University of Texas at Austin,"Austin, TX","$2,813 a month",Assist with data collection and processing. Ability to quantitatively analyze data and present qualitative and quantitative results....56,Jr. Data Scientist,        Comverge Inc,"Denver, CO",,Data Scientist will produce innovative solutions drivenby exploratory data analysis from complex and high-dimensional datasets....57,Statistician,        Napleton Automotive Group,"Oak Brook, IL",,Utilize statistical methods to collect and analyze data. Analyze or interpret data and report conclusions from analyses....58,"Research Scientist, Machine Learning","    Luminoso Technologies, Inc.","Cambridge, MA",,"Communication and data presentation skills. Establish scalable, efficient, reproducible processes for large scale data analyses, model development, model..."59,"RESEARCH ANALYST – SOFTWARE DEVELOPMENT -WASHINGTON, D.C.",        Southwest Research Institute,"Washington, DC",,Design and develop data base supported applications using .Net and SQL Server; Capture user requirements and analyze user needs and software requirements to...60,People Analytics & Research Data Scientist,        BlackRock,"New York, NY 10001 (Chelsea area)",,"We are looking for a data scientist with advanced skills in mathematics, technology and data mining to help build algorithms that leverage large quantities of..."61,Associate,        Exponent,"Phoenix, AZ 85027",,"Our multidisciplinary team of scientists, engineers, physicians, and regulatory consultants brings together more than 90 different disciplines to solve..."62,Exploratory Biomarker Assay Senior Analyst/Analyst (Grade 7/8): LC-MS/MS,        GlaxoSmithKline,Pennsylvania,,"Deliver, interpret and communicate complex scientific data to project/program teams in a timely manner by performing data analysis, record keeping and reporting..."63,Junior Scientist / Engineer,        ECS Federal LLC,"Arlington, VA",,"ECS Federal, LLC (ECS) is seeking a Junior Scientist / Engineer to work in our Arlington, VA office. Design theory, geometric modeling, numerical analysis,..."64,Director of Machine Learning,        UPMC,"Pittsburgh, PA 15206 (Larimer area)",,"Work with product managers, partners and peers to formulate the data analytics problems. Description Job Purpose...."65,"Scientist I, Sequencing",        Roche,"Santa Clara, CA",,"As Scientist I, you will be helping to perform experiments and analyze data to drive development of our sequencing technology...."66,Machine learning / AI / Restful API web services Engineer at Big 4,    CareerMonks,"Atlanta, GA","$120,000 a year","Familiarity with No SQL databases, bot framework, data streaming and integrating unstructured data will be plus. Data exchange technologies like JSON *...."67,Machine Learning Engineer,    Calabrio,"Minneapolis, MN 55401 (North Loop area)",,Customers of trends identified in the data. O Machine Learning with text or speech based data. Experience building machine learning applications using numerical...68,Pilot SME (Senior II Scientist / Engineer / System Analyst),        RWD Consulting,"Washington, DC 20001 (Shaw area)",,"Utilize Comprehensive Electronic Data Analysis and Reporting (CEDAR) tool. Under the Data Management Support task, the Pilot SME will...."69,Machine Learning Researcher,    Schrodinger,"New York, NY",,"Experience using Machine Learning in low data settings. The candidate should understand how Machine Learning algorithms work, and be able to discuss optimal..."70,"Data Scientist, Analytics",        Facebook,"Menlo Park, CA",,The Data Scientist Analytics role has work across the following four areas:. We’re looking for Data Scientists to work on our core and business products at...71,"Scientist, Analytical Chemistry",    Zymergen,"Emeryville, CA 94608",,"Scientist, Analytical Chemistry. Equipment, Data and Team Management. Interact with software engineers for the capture, storage, and processing of measurement..."72,Quantitative Scientist,        Flatiron Health,"New York, NY",,You love working with data and have experience exploring data with a critical and thoughtful eye. Experience working with longitudinal EMR data....73,"Defense Research Analyst, Mid",        Booz Allen Hamilton,"Arlington, VA",,"Job Number: R0003625 Booz Allen Hamilton has been at the forefront of strategy and technology for more than 100 years Today, the firm provides management and"74,Machine Learning Scientist,    Intellipro Group Inc.,California,,"The Big Data Intelligence Group is looking for a Machine Learning Scientist, to develop and apply algorithms and models in areas like nature language processing..."75,Research Scientist,        inVentiv Health Clinical,"Mount Rose, NJ",,"(This includes all aspects of flow cytometry experiments including performing staining experiments of at least 8 colors, FACS machine usage, and data analysis..."76,Advanced Analytics – Sr. Statistician,        Merkle Inc.,"Charlottesville, VA 22902",,"Statistician / Data Scientists. End-to-end experience applying statistical and machine learning in a production environment, including ETL, data quality..."77,Machine Learning Research Scientist,        ARM,"Boston, MA",,"As the industry's leading supplier of microprocessor technology, ARM provides efficient, low-power chip technology making electronic innovations come to life."78,Informatics Scientist,    Northbound LLC,"New Haven, CT 06511 (Newhallville area)",,A comprehensive understanding of data mining and visualization. This experienced informatics scientist will be responsible for applying bioinformatics software...79,Quantitative Analyst,        M&T Bank,"Buffalo, NY",,Support Senior Analysts and Managers in data analysis and model construction. Incorporate observations and data in to existing models to improve predictive...80,Exploratory Biomarker Assay Senior Analyst (Grade 7): Immunoassay,        GlaxoSmithKline,"King of Prussia, PA",,"Deliver, interpret and communicate complex scientific data to project/program teams in a timely manner by performing data analysis, record keeping and reporting..."81,BI/Visualization Analyst,"        Neustar, Inc.","McLean, VA",,Interested in growing as a data scientist or visualization expert to help organizations extract insights in an easy and rapid manner....82,Research Scientist,        Smiths Detection,"Andover, MA 01810",,"The scientist will work closely with various scientists and engineers based in Andover, MA and Santa Ana, CA. Hands-on research including construction/assembly..."83,"Research Scientist, Machine Learning",    Human Longevity,"Mountain View, CA",,"These researchers play a key role in the creation, optimization, and implementation of new methods and processes for the analysis of genotypic and phenotypic..."84,Machine Learning Systems Intern,        Intel,"Hillsboro, OR 97124",,This position focuses on data analytics applications using deep learning and machine learning approaches. The data center is the underpinning for every data...85,Healthcare Statistical Analyst,        Strategic Management,"Alexandria, VA 22315",,"Extracting data and database management, developing data queries, importing/exporting data into various formats...."86,Applied Statistician,"        Advance Services, Inc.","Creve Coeur, MO","$55,000 - $75,000 a year","Analyzes and interprets data from various sources. Responsible for ensuring data quality supplied by vendor. A solid knowledge base in applied statistics, data..."87,Python / Machine Learning Engineer,        Adobe,"San Jose, CA",,"Experience with big data techniques (such as Hadoop, MapReduce, Spark). Familiarity working with large-scale data-sets and big data techniques would be a plus...."88,"Decision Scientist, Marketing Infrastructure",        Facebook,"Menlo Park, CA",,Build data expertise and own data quality for the Marketing organization. We are seeking a talented Decision Scientist who thrives at the intersection of data...89,"Research Scientist, Machine Learning & Signal Processing",    Oculus VR,"Redmond, WA",,"4+ years experience manipulating and analyzing complex, high-volume, high-dimensionality data from varying sources...."90,Bioinformatics Analyst (NCI),        Leidos,"Bethesda, MD 20813",,Management of large genomic data sets including integration with data available from public sources. Processing high throughput biomedical data:....91,Senior Scientist / Engineer,        ECS Federal LLC,"Arlington, VA",,"ECS Federal, LLC (ECS) is seeking a Senior Scientist / Engineer to work in our Arlington, VA office. Demonstrated experience in the use of mathematics and..."92,Machine Learning Engineer,        Cambridge Consultants Ltd,"Boston, MA",,Main Purpose of the Job You will design and develop machine learning systems for a range of clients from industries as diverse as warehouse automation to the93,"Research Scientist, Area Operations, Economics and Computation",        Facebook,"Menlo Park, CA",,"Drive the collection of new data and the refinement of existing data sources. Facebook is seeking a Research Scientist to join the Operations, Economics and..."94,"Clinical Data Scientist (Associate, entry level with DM experience)",        Pfizer Inc.,"New York, NY 10017 (Midtown area)",,"Prepare (or assist in the preparation of) data transfer specifications and data flow for all trial data, including CRF and non-CRF data...."95,Research Scientist,        Ohio State University Medical Center,Ohio,"$47,476 - $50,000 a year","Extracts, compiles, analyzes and evaluates data; Research Scientist to plan, develop and build an independent research program resulting in publishable..."96,Statistical Programmer,    Social & Scientific Systems Inc.,"Silver Spring, MD 20910",,Participates in a highly collaborative environment as an integral member of a clinical project team to create data displays and data summaries for studies...97,Senior Data Scientist - Banking Analytics,        McKinsey & Company,"New York, NY 10022 (Midtown area)",,"As one of the fastest-growing parts of our firm, New Ventures has more than 1,000 dedicated professionals (including more than 800 analysts and data scientists)..."98,Principal Data Scientist (Insights & Analytics),    Coupang(TECH),"Seattle, WA",,Principal Data Scientist. The Insights & Analytics team within the Data team is looking for a Principal Data Scientist with a solid background in advanced...99,Statistician,        Rent A Center,"Plano, TX",,"The Data Scientist will design, develop, and maintain complex customer behavior models and underwriting strategies that enable the Acceptance Now, RAC e..."100,Research Associate 1,"        Kemin Industries, Inc.","Des Moines, IA 50317 (Gray's Woods area)",,Perform basic data analysis. Support other scientists in performing laboratory experiments. Calculate data and put into report format for supervisor/manager....101,Machine Learning and Computational Engineering Researcher,        ARM,"Austin, TX",,"The hardware engineering process is already highly automated, but our existing methods don’t improve with use, learn from experience, or leverage our huge..."102,"Engineer, Machine Learning & AI",        Lenovo,"Chicago, IL",,"Motorola Mobility is one of the world’s fastest growing smartphone providers, creating groundbreaking, affordable, high-quality products designed and built"103,Research Scientist - Big Data Analytics,        Intelligent Automation,"Rockville, MD 20855",,"Cloud, Big data tools and frameworks such as Openstack, Hadoop, Solr, Hbase and Spark, Dockers, Ansible...."104,Project Research Analyst,        ANSER,"Fort Belvoir, VA",,BASIC JOB DESCRIPTION The Analyst conducts organized analytical assessments and evaluations to understand and/or evaluate complex issues to inform decision105,"Data Scientist, Analytics",        MedExpress,"Canonsburg, PA 15317",,Exploratory data analysis. We’re looking for a data scientist to work across all areas of our business. Apply your expertise in quantitative analysis and data...106,Analyst,        Kantar Millward Brown,"Lisle, IL",,"We are looking for a data scientist with experience in marketing analytics, to join us with the title of Analyst...."107,Research Scientist,        Florida International University,"Miami, FL",,Presents scientific papers related to data collection on specific studies. Coordinating and collecting the clinical data with the Regional Reference Laboratory...108,"Software Engineer, Machine Learning",        Facebook,"Boston, MA",,"Develop highly scalable classifiers and tools leveraging machine learning, data regression, and rules based models...."109,Senior Research Analyst,        Central New Mexico Community College,"Albuquerque, NM","$53,137 a year","Organizes, maintains and develops data collection, which includes consulting with staff, faculty and administration to ensure appropriateness of data and..."110,Research Scientist Generative Design Deep Learning,        Siemens,"Princeton, NJ 08540",,"We are currently seeking a Research Scientist Generative Design – Deep Learning for our Princeton, NJ location...."111,Statistician,        Intel,"Hillsboro, OR 97124",,"Ability to work effectively with others, provide team leadership in data analysis and interpretation. Activities include consulting with managers, engineers,..."112,Machine Learning Engineer,    Casetext,"San Francisco, CA",,"Experience training and evaluating ML models on real world data, especially text data. The data team at Casetext is developing groundbreaking technology for..."