0,Data Scientist,        Novetta,"Crystal City, VA",,552,Statistician - Level III,    Cavalier IT Solutions,"Raritan, NJ 08869",,"Position: Statistician - Level III Location: RARITAN, NJ / 08869 Job Id: JNJNJP00046523 Duration: 12+ months POSITION TITLE:  *Contract..."553,"Senior Manager of Data Science, Tech College",        Capital One,"McLean, VA",,"We are looking for a Data Scientist to join our Tech College. Writing software to clean and investigate large, messy data sets of numerical and textual data...."554,Statistical Business Analyst,    Cresttek LLC,"Raymond, OH",,"Proficient in data analytics funtion, pivot tables, vlookup formulas, and name manager functions Programming:...."555,Statistical SAS Programmer,    Whiz Finder Corporation,"Little Falls, NJ 07424",,Archive clinical trial data (study data tabulation models and analysis data models) and programming information in accordance with corporate archival SOPs and...556,Statistical Programmer,    QuintilesIMS,"Plymouth Meeting, PA",,Experience analyzing very large amounts of data. Experience working with Patient-level and/or medical claims-level data....557,2017 Research Scientist,        Intel,"Hillsboro, OR 97124",,"This includes the security of personal and enterprise data in emerging cloud computing paradigms, including technologies such as OpenStack, as well as the..."558,Analytical Scientist,        Eastman Chemical,"Kingsport, TN",,Should be able to lead other scientists and technicians to provide key analytical data for product and process development and to participate in multi...559,L&I Research Analyst 1 (3-year project position),        State of Washington,"Tumwater, WA","$2,792 - $3,627 a month","Record data from experiment. Administer surveys and enter data. Knowledge of statistics and techniques for collecting, compiling, and evaluating data...."560,Senior Data Scientist and Director of Analytics,"    LL Global, Inc","Windsor, CT",,Serve as the Research/IT Liasion for Data Strategy and Key Data Initiatives. Currently we are looking for a Senior Data Scientist and Director of Analytics for...561,Business Intelligence Engineer,        Coursera,"Mountain View, CA 94041",,"3-5 years experience in a data-related field, including data engineering, data warehousing, business intelligence, data visualization, and/or data science...."562,"Software Engineer, Data Science Tools",        Cloudera,"San Francisco, CA 94104 (Financial District area)",,The purpose of this team is to accelerate Cloudera’s next stage of growth by enabling data scientists and data engineers to do more with data from exploration...563,Watson Health - Research Scientist - Truven,        IBM,United States,,"Works with product management, other research scientists and Applied Analytics staff; The research scientist is a member of the Provider Analytics team...."564,Software Engineer (Performance & Data),"        Magic Leap, Inc.","Sunnyvale, CA",,"Develop and implement data processing algorithms in SW. Work with ground truth data acquisition systems, develop algorithms and implement SW components for data..."565,Predictive Modeling Analyst,        Chubb,"Whitehouse Station, NJ",,Data from various sources to create analytics data set. Using SAS or other data management tools from internal and external data....566,"Research Analyst - Supply Chain Technologies, Gartner Research","        Gartner, Inc.","Fort Myers, FL",,"Market research, data collection and analysis. Gartner is the world's leading information technology research and advisory company...."567,Market Research Analyst,        American Heart Association,"Robbinsville, NJ 08691",$15 an hour,+ Compile the data. + Data gathering may include outreach within the community. + Gather data from a variety of sources such as internet;...568,Senior Structural Dynamics Analyst,        Technology Service Corporation,"Alexandria, VA",,"Work closely with design engineers, scientists, launch. Vibration and acoustic survey data to structural models to...."569,Research Coverage Analyst,    GuideStar Clinical Reserach,"New Orleans, LA 70170 (Central Business District area)",,GuideStar is seeking a Research Coverage Analyst who will be responsible for the preparation of Medicare Coverage Analysis to ensure that billing for both570,Research Scientist,        FUJIFILM,"Mesa, AZ",,"Excellent communication, data collection, time management and organizational skills required. Conduct literature search, document results, and present data to..."571,Project Analyst l/ II Gaithersburg Maryland,        Icon plc,"Gaithersburg, MD",,Familiarity with qualitative and/or quantitative data analysis software (preferred). Assist with literature reviews by abstracting data from scientific articles...572,Research & Development Scientist,        Alere,"San Diego, CA 92121",,"Define, author, and execute verification and validation studies and summarize relative data in reports. And thorough analysis, in support of department research..."573,Project Integrator,    MOJA,"McLean, VA",,"As such, the position has individual, team and project management responsibilities and will work closely with analysts, data scientists and software engineers...."574,"Project Associate, EQUAL",    NYU Global TIES for Children,"New York, NY","$52,000 a year",Willingness and ideally interest in developing further statistical and data analysis skills. Alice Wuermli (Research Scientist and Associate Director of Global...575,Research Analyst (3 positions),        MiraCosta College,"Oceanside, CA 92056",$33.58 an hour,Identify required data resources; Analyze data for trends and perform statistical analyses; Generate data sets required for grant applications and reporting....576,Statistical Analyst - Acurian (A PPD Company),        PPD,"Horsham, PA",,"Opportunities hidden in the data and making recommendations on pricing,. To ensure the predictive data models efficiently deliver to business...."577,Staff Procurement Analyst,        Kollmorgen,"Chaska, MN",,"And analyze data, Negotiating Skills, Business Acumen. Professionals and scientists, supplying critical information for improving. Staff Procurement Analyst...."578,"Research Scientist, Big Data Lab","        Hitachi America, Ltd.","Santa Clara, CA 95054",,The Big Data Laboratory extends the scope of our research to contribute further to the realization of Hitachi’s vision of “Social Innovation.” The laboratory...579,Analyst,        sartorius,"Cambridge, MA",,"The analyst will report to the Senior Scientist of the group and will be responsible for the routine maintenance of cell lines, general reagent preparation and..."580,Data Scientist Needed for Disruptive Tech Firm,    Averity,"New York, NY","$80,000 - $120,000 a year",We're looking for a Data Scientist to forge our data endeavors forward. As a Data Scientist reporting directly to our Chief Data Officer and Lead Data Scientist...581,Client Success Manager | Utilities Data Analytics,        Oracle,"San Francisco, CA 94109 (Nob Hill area)",,"Direct the work of data scientists. Meter data in particular. Representatives of the clients to gather requirements on data sources, IT...."582,Lead Statistical Analysis Engineer,        Schneider National,"Green Bay, WI 54313",,"Identify data sources and prepare data (merging data from different sources, cleansing, manipulation, etc.). Schneider is looking for a Data Scientist to help..."583,Scientist II Analysis & Testing,        International Paper,"Federal Way, WA 98001",,"Ability to analyze, summarize and communicate technical data using MS Office software. Plan, conduct, and document experimental work that meets the data and..."584,Information Technology Scientist,        ManTech International Corporation,"Aberdeen Proving Ground, MD",,"Big Data and data fusion platform familiarity. Lead experts in discussion of virtualization, storage and Data analysis...."585,Senior Research Scientist I - Assay Development & Screening,        Albany Molecular Research,"Buffalo, NY 14203 (Willert Park area)",,Record all appropriate data electronically in AMRI databases. Trouble shooting of automated equipment and data analysis templates;...586,BIOSTATISTICIAN I,        Mount Sinai Health System,"New York, NY 10029 (Yorkville area)",,Experience or equivalent in data analysis and data management. Simulation studies and data queries. Clinical studies and analyzing data from large claims...587,Program Scientist,        The Henry M. Jackson Foundation,"Silver Spring, MD 20910",,Coordinate the gathering and assembly of data related to specific projects and perform detailed scientific analysis;...588,Bioinformatics Programmer,        University of California San Francisco,"San Francisco, CA",,"Demonstrated very large scale (meta data) data application knowledge in the field of Health/Medicine. The role includes data and tool management, curation and..."589,Dealership Optimization Consultant,        CDK Global,"Houston, TX",,"From data scientists to sales and operations experts, we’re hiring to support your growth and ours - Green light your career ...."590,Senior Data Scientist and Director of Analytics,        LIMRA,"Windsor, CT",,Serve as the Research/IT Liasion for Data Strategy and Key Data Initiatives. Currently we are looking for a Senior Data Scientist and Director of Analytics for...591,"Data Scientist, Analytics",    Affirm,"San Francisco, CA 94126 (Financial District area)",,"Do you love bringing data to life and driving data driven decision making? Build and maintain reporting/visualization, data infrastructure, and tools to help..."592,Statistical Analyst / BI Analyst,        Aetna,"Hartford, CT 06156",,"Aetna takes our candidate’s data privacy seriously. Organize, update and maintain customer retention data using available tools...."593,Analytical Development Scientist I,        KBI Biopharma,"Durham, NC 27709",,"Associated data analysis and advanced scientific skill set. In-depth experience with bio-analytical techniques such as HPLC/UPLC and Plate-based assays (ELISA,..."594,Behavioral and Social Sciences Research Analyst,"    The Scientific Consulting Group, Inc.","Gaithersburg, MD 20878",,"The Scientific Consulting Group, Inc. seeks a Behavioral and Social Sciences Research (BSSR) Analyst to support the Coordinator of the OAR BSSR Section. This"595,ASSOCIATE COMPUTATIONAL SCIENTIST,        Mount Sinai Health System,"New York, NY 10029 (Yorkville area)",,Scientist works with scientists and researchers to effectively use MSSM HPC. Computational and data workflow;...596,Analytical Scientist – PAS,        Eurofins,"Malvern, PA",,"Peer review of analytical data. Scientist responsibilities include, but are not limited to, the following :...."597,Research Aide,        Arkansas Children's Hospital,"Little Rock, AR 72202 (Downtown area)",,"Presents numerical data effectively; Tasks in support of research administration, assisting research scientists and other personnel, assistance in the animal..."598,Research Scientist III,"        Integrated DNA Technologies, Inc","Coralville, IA 52241",,"Analyzes raw data, reports results and plans the next steps. Data analysis and summary written reports and scientific presentations...."599,Applied Scientist,"    A2Z Development Center, Inc.","Sunnyvale, CA",,"Computer Science fundamentals in object-oriented design, data structures, algorithm design, problem solving, and complexity analysis...."600,"Senior Scientist, Protein Engineering",    Intrexon Corporation.,"Germantown, MD",,"Analyze large molecular datasets including transcriptomic, genomics and proteomics data for basic research purposes using in silica molecular modeling software..."601,Prin Quantitative Analyst,        Exelon,"Baltimore, MD",,"At Exelon, we've got a place for you! Join the nation's leading competitive energy provider, with one of the largest electricity generation portfolios and"602,"Intern, Statistical Programmer",        Mylan,"Morgantown, WV",,"Assist in submission data preparation, especially the attempt to automate the process of SDTM mapping, eCRF bookmarking, spec sheet entry, tabulation/analysis..."603,Sr. Manager - Data Analytics,        KPMG,"Atlanta, GA 30338",,Strong experience in leading and delivering data integration or data analysis projects. Lead the design and development of tools and solutions working with data...604,Healthcare Informatics Analyst,        Wisconsin Physicians Service Insurance Corporation,"Madison, WI 53713",,"Data Analyst, Information Analyst, Technical Analyst, or Data Scientist. You’ll employ statistical and data mining techniques to identify existing issues and..."605,Temporary Research Analyst - Smithsonian Channel,    Smithsonian Networks,"New York, NY 10176 (Murray Hill area)",,Some knowledge of Nielsen TV ratings data. # Temporary Research Analyst - Smithsonian Channel....606,Data Science Analyst,        AIG,"New York, NY",,"We are looking for talented, curious, and creative Data Scientists to join our growing team. Data Science is fundamentally changing the way we do business...."607,Mid-Level Open Source Research Analyst,        Cyberspace Solutions,"Reston, VA",,"Provides on-site Open Source intelligence support to the Intelligence Community; Conducts searches, collects and analyzes information, accesses databases and"608,Research & Development Scientist,        Kao Corporation,"Cincinnati, OH",,"Excellent verbal and written communication skills, with the ability to clearly articulate transfer of thoughts and data...."609,Scientist,        Genzyme,"Westborough, MA",,Present data and results within department and project teams. Analyze existing process and analytical development and commercial manufacturing/QC data to...610,Scientist,    Precision BioSciences,"Durham, NC",,"Accompanying data analysis software proficiency is required. Assist in publishing, patenting or presenting data as needed...."611,Scientist; Next Generation Sequencing,        EMD,Maryland,,You have advanced skills in applicable computer programs including a fundamental understanding of bioinformatics and application to NGS data....612,"2017-04-01 Software Engineer Earning $196,000",    EMF Industries,"McLean, VA","$196,000 a year","Our talented group of Data Scientists, Developers, PMs, and Designers is seeking an individual to augment our business intelligence team...."613,Research Scientist I - GMP,        Seattle Children's Hospital,"Seattle, WA 98101 (Downtown area)",,"Makes detailed observations, records data, as well as assesses the processes and results for reliability/efficacy/compliance...."614,Research Analyst,    HomeUnion,"Irvine, CA 92614",,"Interpret data, formulate reports and make recommendations. Evaluate methodology and key data to ensure that data on the reports are accurate and the angle of..."615,Statistician Intern,        Napleton Automotive Group,"Oak Brook, IL",,Utilize statistical methods to collect and analyze data. Analyze or interpret data and report conclusions from analyses....616,BioInformatics Scientist,    Cancer Genetics Inc,"Morrisville, NC 27560",,"The Bioinformatics Scientist will also be responsible for likewise analysis of publicly available datasets. To analyze and report, both as patient-level reports..."617,Finance Data Analytics Consultant,        IBM,"Rochester, MN 55901",,"Merge data sources; Act as a business consultant, data scientist and solution architect in support of IBM's INTERNAL customers...."618,Experimentation Analyst,        Walmart eCommerce,"San Bruno, CA 94066",,"Experienced working with massive, messy data sets. Experience working as an analyst / data science consultant. Comfortable using the available data to help make..."619,"Marketing Decision Scientist, Building 8",        Facebook,"Menlo Park, CA",,"Translate data insights into actions and recommendations. The ideal candidate will have a strong stakeholder management and leadership track record, proven..."620,Statistical Programmer,"    Ironwood Pharmaceuticals, Inc.","Cambridge, MA 02142 (East Cambridge area)",,"Program data edit checks, as necessary, to facilitate Data Management's data cleaning activities. 3+ of experience programming with clinical trial data...."621,Statistical Business Analyst,    Lumenance LLC,"Raymond, OH 43067",,"Identify new sources of data and methods to improve data collection, analysis, and reporting. Normal / Non-Normal data usage experience...."622,Research Analyst - Consumer Intelligence,        Showtime,"New York, NY 10176 (Murray Hill area)",,"Day to day management of the SNI tracking study - executing requests to the vendor, reviewing and evaluating data deliverables and interpreting data...."623,"Research Analyst, Education",        Child Trends,"Bethesda, MD 20814",,"Write code to manage and analyze data; Tabulate data, produce effective graphs, and write up analysis results...."624,Image Scientist,        BAE Systems,"Springfield, VA",,"Familiarity with commercial and civil data sources, integration of resulting data into ArcGIS. To assist the government/contractor team in optimizing the..."625,Research Associate,    Nima,"San Francisco, CA",,"Enter, process, evaluate, and present relevant data. Assist engineers and scientists with various product testing, and perform other related job functions...."626,Research Analyst,    Nielsen,"New York, NY 10003 (Greenwich Village area)",,"Oversee all data processing and tabulation activities:. Data cleaning, recoding, weighting schema development, tab spec creation, comprehensive table checking,..."627,Bioinformatics Scientist,"    Integrated Laboratory Systems, Inc","Research Triangle Park, NC",,"Define work flows and data management procedures for collection, integration, storage and analysis of large volumes of complex genomic data sets (current..."628,Coastal Ocean Research Scientist,        AER,"Lexington, MA 02421",,"(AER) invites applications for a Coastal Ocean Research Scientist position to be filled as soon as possible at our Lexington, MA office...."629,CLS (MT) / St Mary's of Michigan-Standish / General Lab Anc / PRN Rotating,        St. Mary's,"Standish, MI 48658",,"Performs clerical duties including answering phones, data entry, and filing. Certified Clinical Laboratory Scientist credentialed from the American Society for..."630,Staff Research Scientist,        Criteo,"Palo Alto, CA 94301 (Professorville area)",,"Stochastic gradient descent is great when you have lots of data. Thankfully, you have billions of data points to help you.· Recommender systems:...."631,Satellite Sensor Calibration Scientist,"        Earth Resources Technology, Inc","College Park, MD",,"Experience with common data formats such as netCDF and HDF. Higher (spatial, temporal and spectral) resolution and more accurate sounding data from CrIS and..."632,Healthcare Informatics Analyst,        WPS Health Solutions,"Madison, WI",,"Data Analyst, Information Analyst, Technical Analyst, or Data Scientist. You’ll employ statistical and data mining techniques to identify existing issues and..."633,Data Quality Analyst,        Domino's,"Ann Arbor, MI",,"Must have - Expertise with data quality tools for data profiling, cleansing and standardization. Works closely with Business Analysts, Data Analysts/Scientists,..."634,"Analytics Director, Emerging Technologies",        Cigna,"Bloomfield, CT",,"Team leadership to data scientists to ensure they are growing their. Learning and big data analytics. Power-pivots, cubes, data warehouse, and datamarts...."635,Principal Scientist - Computational Chemistry / Chemical Informatics,        Celgene Corporation,Massachusetts,,Principal Scientist in the Computational Chemistry Department. Enhance our understanding of SAR and influence team strategy by assimilating and interpreting...636,Research Analyst/Dispatcher,    CarrierLists.com,"Owasso, OK",$15 - $20 an hour,CarrierLists.com publishes trucking company data for shippers and brokers. We are currently looking for individuals to conduct research on trucking and...637,Lead R&D Technician,        Honeywell,"Colonial Heights, VA 23834",,Organize own work load to permit multitasking between data collection on one or more instruments while preparing additional samples or analyzing existing data....638,Scientist – Genome Analysis Unit (Computational Biology),        Amgen,"South San Francisco, CA 94080",,Prior experience with interpretation and analysis of RNA-Seq data. Work with large biological data sets including Next Generation Sequencing (NGS) data (RNA-Seq...639,Head of Behavioral Analytics,        Atlassian,"San Francisco, CA 94103 (South Of Market area)",,Growing analysts and data scientists. We're looking for someone who is deeply data driven and able to use their influence to improve Atlassian's usage of the...640,Research Analyst: National Parks & Public Lands,    Resource Systems Group Inc.,"White River Junction, VT",,"Managing and fielding data collection efforts; Aptitude for working with data and conducting analyses using statistical packages, databases, and spreadsheets, e..."641,Defense Research Analyst,        Booz Allen Hamilton,"Washington, DC",,"Job Number: R0001503 Booz Allen Hamilton has been at the forefront of strategy and technology for more than 100 years Today, the firm provides management and"642,Research and Development Trainee,        TAKATA,"Kernersville, NC",,"Knowledge of quality-related statistics - control charts, data analysis. We are scientists, engineers, partners and ambassadors—all focused on the next..."643,Senior Machine Learning Scientist,    TuSimple LLC,"San Diego, CA",,We’re looking for smart and entrepreneurial people to join the world’s leading scientists and researchers team....644,Associate Researcher I,        Microsoft,"Redmond, WA 98052",,"Data stream curation, data cleaning, and data visualization are also expected. CVP, Chief Economist Preston McAfee along with the team’s growing number of..."645,Senior Data Analytics Researcher,        ABB,"Raleigh, NC 27606 (West area)",,"Experience in data analysis & data mining tools (R, RapidMiner, Weka, Mathematica, Matlab, etc.). Experience building data collection & information analysis..."646,Data and System Analytics Manager,        United Network for Organ Sharing,"Richmond, VA 23219 (City Center area)",,"Proven data analysis, data. Data Analytics Support. OPTN data system preferred. Experience or education in data...."647,"Senior Scientist, Statistical Genetics Job",        Merck,"Boston, MA",,"Senior Scientist, Statistical Genetics-BIO004788. The candidate will develop and leverage academic collaborations, public-private partnerships, data from..."648,Watson Health - Senior Methods Analyst - Truven,        IBM,United States,,"Work collaboratively with data scientists, clinicians, and other experts to ensure that methodologies meet the stated business requirements...."649,"Team Lead-Product Owner, Service Analytics",        Teradata,"San Diego, CA",,"Experience with big data platform technologies, extensive knowledge of data integration, enterprise data warehouse and data lake...."650,Intelligence Analyst SME,    The Tauri Group,"Alexandria, VA",,"Analyze data, develop information, and assess available solutions or alternative. At The Tauri Group, you'll collaborate with an elite, creative team of..."651,Senior Research Scientist,    MachineZone,"Palo Alto, CA",,"Data driven decision-making is integral to game development, platform, marketing and operations at MZ. Experience with mining of data streams and frameworks..."652,"Research Analyst - Supply Chain Strategy & Enablement, Gartner Research","        Gartner, Inc.","Fort Myers, FL",,"Market research, data collection and analysis. Gartner is the world's leading information technology research and advisory company...."653,Machine Learning Intern (Summer),        SAS Institute,"Cary, NC",,"These challenges involving big data mean one thing:. Coursework in machine learning, data mining, statistical modeling, optimization...."654,Research Analyst -- Consumer Insights,        Hanover Research,"Arlington, VA 22203 (Bluemont area)",,Collect and analyze quantitative research data from surveys and other data sources; The core capabilities that drive Hanover’s research engine include primary...655,Computational Biologist,    Constellation Pharmaceuticals,"Cambridge, MA",,"Experience with NGS experiment design and data analyses, including biological functional analysis of expression data...."656,Behavioral Research Associate,        Delos,"Rochester, MN",,"Assist in the collection and analysis of behavioral data. Data entry and basic data analysis knowledge and experience, including experience with statistics..."657,Scientist,    Northbound LLC,"Barrington, IL 60010",,Scientist and documentation specialist. Scientist and documentation specialist plays a key role in R&D US team....658,Brain Trauma Research Scientist (Neuroscientist),        Leidos,"Bethesda, MD 20813",,Utilizes established mathematical and scientific techniques to compile and analyze data. Leidos’s Federal Health Operation has a contingent opportunity for a...659,Scientist-Software Engineer (ADX003-17),    ArcherDX,"Boulder, CO",,Demonstrated ability to create data visualizations; The commercial “Scientist - Software Engineer” position is responsible for development of software...660,Digital Business Analyst,        Wunderman,"Memphis, TN",,"Headquartered in New York, the agency brings together 7,000 creatives, data scientists, strategists and technologists in 175 offices in 60 markets...."661,Machine Learning Lead,    Originate,"Los Angeles, CA",,"Deep understanding of data engineering - data pipelines, storage, warehousing, ETL, etc. Build effective data visualizations and dashboards...."